"","","","’ pueden realizar"
"consultas  relacionadas  a","","los  Comprobantes  Fiscales  Electrónicos","(e-CF),  entre  otras  acciones"
"","Consulta  de  Anulaciones.","Esta  opción  permite  realizar","la  búsqueda  de  Números  de"
"","","Comprobantes Fiscales Electrónicos Anulados, por rangos de fecha.",""
"","Consulta  e-NCF  Emi�dos.","Esta  opción  permite  realizar","la  búsqueda  de  Números  de"
"","Comprobantes  Fiscales  Electrónicos","","por  e-NCF  o  por  rango  de  fecha;  la  misma"
"","con�ene los siguientes ﬁltros de búsqueda:","",""
